,mal_id,title,title_english,title_japanese,rating,score,popularity,episodes,year,season,producers,studios,genres,favorites,members,synopsis,duration
14,24,School Rumble,School Rumble,スクールランブル,PG-13 - Teens 13 or older,7.88,787,26.0,2004.0,fall,"[{'mal_id': 16, 'type': 'anime', 'name': 'TV Tokyo', 'url': 'https://myanimelist.net/anime/producer/16/TV_Tokyo'}, {'mal_id': 64, 'type': 'anime', 'name': 'Sotsu', 'url': 'https://myanimelist.net/anime/producer/64/Sotsu'}, {'mal_id': 82, 'type': 'anime', 'name': 'Marvelous Entertainment', 'url': 'https://myanimelist.net/anime/producer/82/Marvelous_Entertainment'}, {'mal_id': 92, 'type': 'anime', 'name': 'Starchild Records', 'url': 'https://myanimelist.net/anime/producer/92/Starchild_Records'}, {'mal_id': 108, 'type': 'anime', 'name': 'Media Factory', 'url': 'https://myanimelist.net/anime/producer/108/Media_Factory'}, {'mal_id': 315, 'type': 'anime', 'name': 'DAX Production', 'url': 'https://myanimelist.net/anime/producer/315/DAX_Production'}]","[{'mal_id': 126, 'type': 'anime', 'name': 'Studio Comet', 'url': 'https://myanimelist.net/anime/producer/126/Studio_Comet'}]","[{'mal_id': 4, 'type': 'anime', 'name': 'Comedy', 'url': 'https://myanimelist.net/anime/genre/4/Comedy'}, {'mal_id': 22, 'type': 'anime', 'name': 'Romance', 'url': 'https://myanimelist.net/anime/genre/22/Romance'}]",5363,341755,"Just the words ""I love you,"" and everything changes—such is the nature of the bittersweet trials of high school romance. Tenma Tsukamoto, a second year, is on a quest to confess her feelings to the boy she likes. Kenji Harima, a delinquent with a sizable reputation, is in a similar situation, as he cannot properly convey his feelings to the one he loves. Between school, friends, rivalries, and hobbies, these two will find that high school romance is no walk in the park, especially as misunderstandings further complicate their plight.

School Rumble is a high-octane romantic comedy full of relatable situations, as Tenma and Kenji both try to win the hearts of those they desire.

[Written by MAL Rewrite]",23 min per ep
15,25,Sunabouzu,Desert Punk,砂ぼうず,R - 17+ (violence & profanity),7.36,1728,24.0,2004.0,fall,"[{'mal_id': 42, 'type': 'anime', 'name': 'GDH', 'url': 'https://myanimelist.net/anime/producer/42/GDH'}, {'mal_id': 144, 'type': 'anime', 'name': 'Pony Canyon', 'url': 'https://myanimelist.net/anime/producer/144/Pony_Canyon'}, {'mal_id': 146, 'type': 'anime', 'name': 'CBC Television', 'url': 'https://myanimelist.net/anime/producer/146/CBC_Television'}, {'mal_id': 2981, 'type': 'anime', 'name': 'Omnibus Promotion', 'url': 'https://myanimelist.net/anime/producer/2981/Omnibus_Promotion'}, {'mal_id': 3018, 'type': 'anime', 'name': 'RKB Mainichi Broadcasting Corporation', 'url': 'https://myanimelist.net/anime/producer/3018/RKB_Mainichi_Broadcasting_Corporation'}]","[{'mal_id': 3, 'type': 'anime', 'name': 'Gonzo', 'url': 'https://myanimelist.net/anime/producer/3/Gonzo'}]","[{'mal_id': 1, 'type': 'anime', 'name': 'Action', 'url': 'https://myanimelist.net/anime/genre/1/Action'}, {'mal_id': 2, 'type': 'anime', 'name': 'Adventure', 'url': 'https://myanimelist.net/anime/genre/2/Adventure'}, {'mal_id': 4, 'type': 'anime', 'name': 'Comedy', 'url': 'https://myanimelist.net/anime/genre/4/Comedy'}, {'mal_id': 24, 'type': 'anime', 'name': 'Sci-Fi', 'url': 'https://myanimelist.net/anime/genre/24/Sci-Fi'}, {'mal_id': 9, 'type': 'anime', 'name': 'Ecchi', 'url': 'https://myanimelist.net/anime/genre/9/Ecchi'}]",872,149273,"The Great Kanto Desert, a sweltering wasteland of nothing but ruins and sand, is all that remains of post-apocalyptic Japan. The once fair population has been left to cling to the inhospitable dunes for survival. At least, that is the case for normal people. For those who have spent a little too long in the Kanto sun, the desert offers a wondrous opportunity to make a name for themselves.

One such person is the masked handyman ""Sunabouzu,"" or Desert Punk, who has forged a legendary reputation for always finishing his jobs, no matter the nature or cost. Cunning and ruthless, he has become a force of crude destruction to the other desert people. However, the ""Vixen of the Desert,"" Junko Asagiri, discovers that Sunabouzu is not without his weaknesses—he is easily swayed by his insatiable lust for large-breasted desert babes. 

Following their chaotic adventures through the Kanto Desert, Sunabouzu features a bizarre cast of personalities who entertain themselves with senseless violence and perversion in a world long destroyed by their forefathers. And just like them, they have not learned a damn thing.

[Written by MAL Rewrite]",24 min per ep
16,26,Texhnolyze,Texhnolyze,TEXHNOLYZE,R+ - Mild Nudity,7.75,969,22.0,2003.0,spring,"[{'mal_id': 86, 'type': 'anime', 'name': 'Group TAC', 'url': 'https://myanimelist.net/anime/producer/86/Group_TAC'}, {'mal_id': 160, 'type': 'anime', 'name': 'Rondo Robe', 'url': 'https://myanimelist.net/anime/producer/160/Rondo_Robe'}, {'mal_id': 169, 'type': 'anime', 'name': 'Fuji TV', 'url': 'https://myanimelist.net/anime/producer/169/Fuji_TV'}, {'mal_id': 204, 'type': 'anime', 'name': 'Pioneer LDC', 'url': 'https://myanimelist.net/anime/producer/204/Pioneer_LDC'}, {'mal_id': 211, 'type': 'anime', 'name': 'Rakuonsha', 'url': 'https://myanimelist.net/anime/producer/211/Rakuonsha'}, {'mal_id': 1459, 'type': 'anime', 'name': 'Geneon Entertainment USA', 'url': 'https://myanimelist.net/anime/producer/1459/Geneon_Entertainment_USA'}]","[{'mal_id': 11, 'type': 'anime', 'name': 'Madhouse', 'url': 'https://myanimelist.net/anime/producer/11/Madhouse'}]","[{'mal_id': 5, 'type': 'anime', 'name': 'Avant Garde', 'url': 'https://myanimelist.net/anime/genre/5/Avant_Garde'}, {'mal_id': 8, 'type': 'anime', 'name': 'Drama', 'url': 'https://myanimelist.net/anime/genre/8/Drama'}, {'mal_id': 7, 'type': 'anime', 'name': 'Mystery', 'url': 'https://myanimelist.net/anime/genre/7/Mystery'}, {'mal_id': 24, 'type': 'anime', 'name': 'Sci-Fi', 'url': 'https://myanimelist.net/anime/genre/24/Sci-Fi'}, {'mal_id': 41, 'type': 'anime', 'name': 'Suspense', 'url': 'https://myanimelist.net/anime/genre/41/Suspense'}]",5543,280114,"In the dark underground city of Lux, people live in fear and despair under the rule of various criminal factions. Almost secluded from the surface, the gangs' only interaction with the outer world is their mining operation of ""raffia,"" which is the raison d'être of the city.

Available only in Lux, this rare substance is the basis of ""texhnolyze"" transplants that permit humans to replace parts of their body with cybernetic prostheses. The latter have the particularity not to trigger an immune response in their hosts and the ""Class"" has the privilege to conduct research on them. This elusive organization, also in charge of the raffia production, delegates its executive authority to a group called Organo led by Keigo Oonishi—a self-righteous man with texhnolyzed legs who is rumored to hear the ""voice of the city.""

The fragile balance of powers in Lux is disturbed when a mysterious visitor named Kazuho Yoshii begins committing a series of crimes that puts the gangs at each other's throats. In the midst of the chaos, new actors emerge: Ichise, an ex-boxer mutilated by Organo and recently texhnolyzed by Eriko ""Doc"" Kamata; and Ran, a young florist who can see the future. While Lux steadily plunges into insanity, both Ichise and Ran find themselves involved in the greatest crisis the city has ever faced.

[Written by MAL Rewrite]",23 min per ep
17,27,Trinity Blood,Trinity Blood,トリニティ・ブラッド,R - 17+ (violence & profanity),7.28,1376,24.0,2005.0,spring,[],"[{'mal_id': 3, 'type': 'anime', 'name': 'Gonzo', 'url': 'https://myanimelist.net/anime/producer/3/Gonzo'}]","[{'mal_id': 1, 'type': 'anime', 'name': 'Action', 'url': 'https://myanimelist.net/anime/genre/1/Action'}, {'mal_id': 10, 'type': 'anime', 'name': 'Fantasy', 'url': 'https://myanimelist.net/anime/genre/10/Fantasy'}, {'mal_id': 24, 'type': 'anime', 'name': 'Sci-Fi', 'url': 'https://myanimelist.net/anime/genre/24/Sci-Fi'}]",1394,196499,"Following Armageddon, an apocalyptic war, mankind faces yet another menace: vampires. The continuous confrontations between the races have split the world into separate factions. The race of vampires, Methuselah, are affiliated with the New Human Empire; whereas the humans, deemed Terrans by the vampires, make up the Vatican Papal State. Furthermore, extremist groups like the Rosenkreuz Order strive to rekindle a war, despite the factions' attempts to avoid direct conflict.

To combat terrorist organizations, the Vatican has implemented the AX unit. Led by Cardinal Caterina Sforza, the AX agents investigate vampire-related disturbances with hopes that the Terrans and the Methuselah will one day achieve peaceful coexistence. Amongst the AX unit is priest Abel Nightroad—a seemingly disoriented but gentle-hearted fellow who is a fierce vampire slayer on the battlefield. Joining the unit as his partner is agent Sister Esther Blanchett, a brave and gentle young nun troubled with a tragic past. 

As the two grow closer, they begin to uncover signs of malicious schemes and dark forces working in the shadows. But the path they walk is riddled with misfortune that might just force them to confront the memories that plague their hearts.

[Written by MAL Rewrite]",24 min per ep
18,28,Yakitate!! Japan,Yakitate!! Japan,焼きたて!! ジャぱん,PG-13 - Teens 13 or older,7.91,2265,69.0,2004.0,fall,"[{'mal_id': 16, 'type': 'anime', 'name': 'TV Tokyo', 'url': 'https://myanimelist.net/anime/producer/16/TV_Tokyo'}, {'mal_id': 17, 'type': 'anime', 'name': 'Aniplex', 'url': 'https://myanimelist.net/anime/producer/17/Aniplex'}, {'mal_id': 164, 'type': 'anime', 'name': 'd-rights', 'url': 'https://myanimelist.net/anime/producer/164/d-rights'}, {'mal_id': 577, 'type': 'anime', 'name': 'Tohokushinsha Film Corporation', 'url': 'https://myanimelist.net/anime/producer/577/Tohokushinsha_Film_Corporation'}, {'mal_id': 1175, 'type': 'anime', 'name': 'Atelier Musa', 'url': 'https://myanimelist.net/anime/producer/1175/Atelier_Musa'}]","[{'mal_id': 14, 'type': 'anime', 'name': 'Sunrise', 'url': 'https://myanimelist.net/anime/producer/14/Sunrise'}]","[{'mal_id': 4, 'type': 'anime', 'name': 'Comedy', 'url': 'https://myanimelist.net/anime/genre/4/Comedy'}, {'mal_id': 47, 'type': 'anime', 'name': 'Gourmet', 'url': 'https://myanimelist.net/anime/genre/47/Gourmet'}]",942,104137,"While countries such as France, England, and Germany all have their own internationally celebrated bread, Japan simply does not have one that can match in reputation.

Thus after discovering the wonders of breadmaking at a young age, Kazuma Azuma embarks on a quest to create Japan's own unique national bread. And being blessed with unusually warm hands that allow dough to ferment faster, Azuma is able to bring his baking innovations to another level.

As he begins working at the prestigious Japanese bakery chain, Pantasia, Azuma encounters other talented bakers and experiences firsthand the competitive world of baking. Along with his newfound friends and rivals, Azuma strives to create new and unparalleled bread that will start a baking revolution. 

[Written by MAL Rewrite]",24 min per ep
19,29,Zipang,,ジパング,PG-13 - Teens 13 or older,7.49,4907,26.0,2004.0,fall,"[{'mal_id': 82, 'type': 'anime', 'name': 'Marvelous Entertainment', 'url': 'https://myanimelist.net/anime/producer/82/Marvelous_Entertainment'}, {'mal_id': 140, 'type': 'anime', 'name': 'Animax', 'url': 'https://myanimelist.net/anime/producer/140/Animax'}, {'mal_id': 144, 'type': 'anime', 'name': 'Pony Canyon', 'url': 'https://myanimelist.net/anime/producer/144/Pony_Canyon'}, {'mal_id': 145, 'type': 'anime', 'name': 'TBS', 'url': 'https://myanimelist.net/anime/producer/145/TBS'}]","[{'mal_id': 37, 'type': 'anime', 'name': 'Studio Deen', 'url': 'https://myanimelist.net/anime/producer/37/Studio_Deen'}]","[{'mal_id': 1, 'type': 'anime', 'name': 'Action', 'url': 'https://myanimelist.net/anime/genre/1/Action'}, {'mal_id': 8, 'type': 'anime', 'name': 'Drama', 'url': 'https://myanimelist.net/anime/genre/8/Drama'}, {'mal_id': 24, 'type': 'anime', 'name': 'Sci-Fi', 'url': 'https://myanimelist.net/anime/genre/24/Sci-Fi'}]",202,24886,"A Ripple in Time Turns the Crucial Tide of WWII.

Scheduled for routine military exercises, Commander Kadomatsu and the crew of Japan's newest and most modern Battlecruiser, The Mirai, are ready to test out the ship's state-of-the-art Aegis System. Instead, they find themselves transported back to June 4th, 1942—date of the crucial Battle of Midway, where the Japanese fleet was dealt a crippling blow. When an overzealous Kadomatsu rescues one of the battle's victims, Kusaka, from a sinking zero fighter, the Mirai's fate is sealed. The crew pledges not to do anything to alter the past further. However, they're now forced to fight a U.S. submarine in a battle that should never have occurred. Thus setting off a chain of events that may forever change the flow of history!

(Source: Geneon Entertainment USA, edited)",24 min per ep
20,30,Shinseiki Evangelion,Neon Genesis Evangelion,新世紀エヴァンゲリオン,PG-13 - Teens 13 or older,8.36,45,26.0,1995.0,fall,"[{'mal_id': 16, 'type': 'anime', 'name': 'TV Tokyo', 'url': 'https://myanimelist.net/anime/producer/16/TV_Tokyo'}, {'mal_id': 113, 'type': 'anime', 'name': 'Kadokawa Shoten', 'url': 'https://myanimelist.net/anime/producer/113/Kadokawa_Shoten'}, {'mal_id': 139, 'type': 'anime', 'name': 'Nihon Ad Systems', 'url': 'https://myanimelist.net/anime/producer/139/Nihon_Ad_Systems'}, {'mal_id': 1461, 'type': 'anime', 'name': 'Audio Tanaka', 'url': 'https://myanimelist.net/anime/producer/1461/Audio_Tanaka'}]","[{'mal_id': 6, 'type': 'anime', 'name': 'Gainax', 'url': 'https://myanimelist.net/anime/producer/6/Gainax'}, {'mal_id': 103, 'type': 'anime', 'name': 'Tatsunoko Production', 'url': 'https://myanimelist.net/anime/producer/103/Tatsunoko_Production'}]","[{'mal_id': 5, 'type': 'anime', 'name': 'Avant Garde', 'url': 'https://myanimelist.net/anime/genre/5/Avant_Garde'}, {'mal_id': 46, 'type': 'anime', 'name': 'Award Winning', 'url': 'https://myanimelist.net/anime/genre/46/Award_Winning'}, {'mal_id': 8, 'type': 'anime', 'name': 'Drama', 'url': 'https://myanimelist.net/anime/genre/8/Drama'}, {'mal_id': 24, 'type': 'anime', 'name': 'Sci-Fi', 'url': 'https://myanimelist.net/anime/genre/24/Sci-Fi'}, {'mal_id': 41, 'type': 'anime', 'name': 'Suspense', 'url': 'https://myanimelist.net/anime/genre/41/Suspense'}]",114854,1976281,"Fifteen years after a cataclysmic event known as the Second Impact, the world faces a new threat: monstrous celestial beings called Angels invade Tokyo-3 one by one. Mankind is unable to defend themselves against the Angels despite utilizing their most advanced munitions and military tactics. The only hope for human salvation rests in the hands of NERV, a mysterious organization led by the cold Gendou Ikari. NERV operates giant humanoid robots dubbed ""Evangelions"" to combat the Angels with state-of-the-art advanced weaponry and protective barriers known as Absolute Terror Fields.

Years after being abandoned by his father, Shinji Ikari, Gendou's 14-year-old son, returns to Tokyo-3. Shinji undergoes a perpetual internal battle against the deeply buried trauma caused by the loss of his mother and the emotional neglect he suffered at the hands of his father. Terrified to open himself up to another, Shinji's life is forever changed upon meeting 29-year-old Misato Katsuragi, a high-ranking NERV officer who shows him a free-spirited maternal kindness he has never experienced.

A devastating Angel attack forces Shinji into action as Gendou reveals his true motive for inviting his son back to Tokyo-3: Shinji is the only child capable of efficiently piloting Evangelion Unit-01, a new robot that synchronizes with his biometrics. Despite the brutal psychological trauma brought about by piloting an Evangelion, Shinji defends Tokyo-3 against the angelic threat, oblivious to his father's dark machinations.

[Written by MAL Rewrite]",24 min per ep
21,31,Shinseiki Evangelion Movie: Shi to Shinsei,Neon Genesis Evangelion: Death & Rebirth,新世紀エヴァンゲリオン劇場版 シト新生,R - 17+ (violence & profanity),7.49,985,1.0,,,"[{'mal_id': 16, 'type': 'anime', 'name': 'TV Tokyo', 'url': 'https://myanimelist.net/anime/producer/16/TV_Tokyo'}, {'mal_id': 18, 'type': 'anime', 'name': 'Toei Animation', 'url': 'https://myanimelist.net/anime/producer/18/Toei_Animation'}, {'mal_id': 113, 'type': 'anime', 'name': 'Kadokawa Shoten', 'url': 'https://myanimelist.net/anime/producer/113/Kadokawa_Shoten'}, {'mal_id': 166, 'type': 'anime', 'name': 'Movic', 'url': 'https://myanimelist.net/anime/producer/166/Movic'}, {'mal_id': 167, 'type': 'anime', 'name': 'Sega', 'url': 'https://myanimelist.net/anime/producer/167/Sega'}, {'mal_id': 717, 'type': 'anime', 'name': 'TV Tokyo Music', 'url': 'https://myanimelist.net/anime/producer/717/TV_Tokyo_Music'}, {'mal_id': 1461, 'type': 'anime', 'name': 'Audio Tanaka', 'url': 'https://myanimelist.net/anime/producer/1461/Audio_Tanaka'}]","[{'mal_id': 6, 'type': 'anime', 'name': 'Gainax', 'url': 'https://myanimelist.net/anime/producer/6/Gainax'}, {'mal_id': 10, 'type': 'anime', 'name': 'Production I.G', 'url': 'https://myanimelist.net/anime/producer/10/Production_IG'}, {'mal_id': 103, 'type': 'anime', 'name': 'Tatsunoko Production', 'url': 'https://myanimelist.net/anime/producer/103/Tatsunoko_Production'}]","[{'mal_id': 8, 'type': 'anime', 'name': 'Drama', 'url': 'https://myanimelist.net/anime/genre/8/Drama'}, {'mal_id': 24, 'type': 'anime', 'name': 'Sci-Fi', 'url': 'https://myanimelist.net/anime/genre/24/Sci-Fi'}, {'mal_id': 41, 'type': 'anime', 'name': 'Suspense', 'url': 'https://myanimelist.net/anime/genre/41/Suspense'}]",792,276228,"In the year 2015, more than a decade has passed since the catastrophic event known as Second Impact befell mankind. During this time of recovery, a select few learned of beings known as the Angels—colossal malevolent entities with the intention of triggering the Third Impact and wiping out the rest of humanity.

Called into the city of Tokyo-3 by his father Gendou Ikari, teenager Shinji is thrust headlong into humanity's struggle. Separated from Gendou since the death of his mother, Shinji presumes that his father wishes to repair their shattered familial bonds; instead, he discovers that he was brought to pilot a giant machine capable of fighting the Angels, Evangelion Unit-01. Forced to battle against wave after wave of mankind's greatest threat, the young boy finds himself caught in the middle of a plan that could affect the future of humanity forever.

[Written by MAL Rewrite]",1 hr 44 min
22,32,"Shinseiki Evangelion Movie: Air/Magokoro wo, Kimi ni",Neon Genesis Evangelion: The End of Evangelion,"新世紀エヴァンゲリオン劇場版 Air / まごころを, 君に",R+ - Mild Nudity,8.56,178,1.0,,,"[{'mal_id': 16, 'type': 'anime', 'name': 'TV Tokyo', 'url': 'https://myanimelist.net/anime/producer/16/TV_Tokyo'}, {'mal_id': 18, 'type': 'anime', 'name': 'Toei Animation', 'url': 'https://myanimelist.net/anime/producer/18/Toei_Animation'}, {'mal_id': 92, 'type': 'anime', 'name': 'Starchild Records', 'url': 'https://myanimelist.net/anime/producer/92/Starchild_Records'}, {'mal_id': 113, 'type': 'anime', 'name': 'Kadokawa Shoten', 'url': 'https://myanimelist.net/anime/producer/113/Kadokawa_Shoten'}, {'mal_id': 166, 'type': 'anime', 'name': 'Movic', 'url': 'https://myanimelist.net/anime/producer/166/Movic'}, {'mal_id': 167, 'type': 'anime', 'name': 'Sega', 'url': 'https://myanimelist.net/anime/producer/167/Sega'}, {'mal_id': 717, 'type': 'anime', 'name': 'TV Tokyo Music', 'url': 'https://myanimelist.net/anime/producer/717/TV_Tokyo_Music'}, {'mal_id': 1344, 'type': 'anime', 'name': 'King Records', 'url': 'https://myanimelist.net/anime/producer/1344/King_Records'}, {'mal_id': 1461, 'type': 'anime', 'name': 'Audio Tanaka', 'url': 'https://myanimelist.net/anime/producer/1461/Audio_Tanaka'}]","[{'mal_id': 6, 'type': 'anime', 'name': 'Gainax', 'url': 'https://myanimelist.net/anime/producer/6/Gainax'}, {'mal_id': 10, 'type': 'anime', 'name': 'Production I.G', 'url': 'https://myanimelist.net/anime/producer/10/Production_IG'}]","[{'mal_id': 5, 'type': 'anime', 'name': 'Avant Garde', 'url': 'https://myanimelist.net/anime/genre/5/Avant_Garde'}, {'mal_id': 8, 'type': 'anime', 'name': 'Drama', 'url': 'https://myanimelist.net/anime/genre/8/Drama'}, {'mal_id': 24, 'type': 'anime', 'name': 'Sci-Fi', 'url': 'https://myanimelist.net/anime/genre/24/Sci-Fi'}, {'mal_id': 41, 'type': 'anime', 'name': 'Suspense', 'url': 'https://myanimelist.net/anime/genre/41/Suspense'}]",31569,1014290,"Shinji Ikari is left emotionally comatose after the death of a dear friend. With his son mentally unable to pilot the humanoid robot Evangelion Unit-01, Gendou Ikari's NERV races against the shadow organization SEELE to see who can enact their ultimate plan first. SEELE desires to create a godlike being by fusing their own souls into an Evangelion unit, while Gendou wishes to revert all of humanity into one primordial being so that he can be reunited with Yui, his deceased wife.

SEELE unleashes its military forces in a lethal invasion of NERV headquarters. As SEELE's forces cut down NERV's scientists and security personnel, Asuka Langley Souryuu pilots Evangelion Unit-02 in a desperate last stand against SEELE's heaviest weaponry.

The battle rages on, and a depressed Shinji hides deep within NERV's headquarters. With the fate of the world resting in Shinji's hands, Captain Misato Katsuragi hunts for the teenage boy as society crumbles around them.

[Written by MAL Rewrite]",1 hr 26 min
23,33,Kenpuu Denki Berserk,Berserk,剣風伝奇ベルセルク,R+ - Mild Nudity,8.61,301,25.0,1997.0,fall,"[{'mal_id': 29, 'type': 'anime', 'name': 'VAP', 'url': 'https://myanimelist.net/anime/producer/29/VAP'}, {'mal_id': 148, 'type': 'anime', 'name': 'Hakusensha', 'url': 'https://myanimelist.net/anime/producer/148/Hakusensha'}, {'mal_id': 1003, 'type': 'anime', 'name': 'Nippon Television Network', 'url': 'https://myanimelist.net/anime/producer/1003/Nippon_Television_Network'}]","[{'mal_id': 28, 'type': 'anime', 'name': 'OLM', 'url': 'https://myanimelist.net/anime/producer/28/OLM'}]","[{'mal_id': 1, 'type': 'anime', 'name': 'Action', 'url': 'https://myanimelist.net/anime/genre/1/Action'}, {'mal_id': 2, 'type': 'anime', 'name': 'Adventure', 'url': 'https://myanimelist.net/anime/genre/2/Adventure'}, {'mal_id': 8, 'type': 'anime', 'name': 'Drama', 'url': 'https://myanimelist.net/anime/genre/8/Drama'}, {'mal_id': 10, 'type': 'anime', 'name': 'Fantasy', 'url': 'https://myanimelist.net/anime/genre/10/Fantasy'}, {'mal_id': 14, 'type': 'anime', 'name': 'Horror', 'url': 'https://myanimelist.net/anime/genre/14/Horror'}]",30855,742760,"Guts, a man who will one day be known as the Black Swordsman, is a young traveling mercenary characterized by the large greatsword he carries. He accepts jobs that offer the most money, but he never stays with one group for long—until he encounters the Band of the Falcon. Ambushed after completing a job, Guts crushes many of its members in combat. Griffith, The Band of the Falcon's leader and founder, takes an interest in Guts and duels him. While the others are no match for Guts, Griffith defeats him in one blow.

Incapacitated and taken into the Band of the Falcon's camp to recover, Guts wakes up two days later. He confronts Griffith, and the two duel yet again, only this time with a condition: Guts will join the Band of the Falcon if he loses. Due to his fresh injuries, Guts loses the fight and is inducted by Griffith.

In three years' time, Guts has become one of the Band of the Falcon's commanders. On the battlefield, his combat prowess is second only to Griffith as he takes on large groups of enemies all on his own. With Guts' immense strength and Griffith's leadership, the Band of the Falcon dominate every battle they partake in. But something menacing lurks in the shadows, threatening to change Guts' life forever.

[Written by MAL Rewrite]",23 min per ep
